{
  "last_updated": 1640887163,
  "ttl": 1800,
  "version": "2.3",
  "data": {
    "system_id": "example_cityname",
    "language": "en",
    "name": "Example Bike Rental",
    "short_name": "Example Bike",
    "operator": "Example Sharing, Inc",
    "url": "https://www.example.com",
    "purchase_url": "https://www.example.com",
    "start_date": "2010-06-10",
    "phone_number": "1-800-555-1234",
    "email": "customerservice@example.com",
    "feed_contact_email": "datafeed@example.com",
    "timezone": "America/Chicago",
    "license_url": "https://www.example.com/data-license.html",
    "terms_url": "https://www.example.com/terms",
    "terms_last_updated": "2021-06-21",
    "privacy_url": "https://www.example.com/privacy-policy",
    "privacy_last_updated": "2019-01-13",
    "rental_apps": {
      "android": {
        "discovery_uri": "com.example.android://",
        "store_uri": "https://play.google.com/store/apps/details?id=com.example.android"
      },
      "ios": {
        "store_uri": "https://apps.apple.com/app/apple-store/id123456789",
        "discovery_uri": "com.example.ios://"
      }
    },
    "brand_assets": {
        "brand_last_modified": "2021-06-15",
        "brand_image_url": "https://www.example.com/assets/brand_image.svg",
        "brand_image_url_dark": "https://www.example.com/assets/brand_image_dark.svg",
        "color": "#C2D32C",
        "brand_terms_url": "https://www.example.com/assets/brand.pdf"
      }
      
  }
}
